Title,Text,Section
"US- Canada border closed after vehicle explosion on bridge, FBI responds","We're now on WhatsApp. Click to join.

The state agencies are on site, the governor informed as US media reported that all four international border crossings between the United States and Canada in Western New York were closed due to an incident involving a vehicle at the Rainbow Bridge.

The Rainbow Bridge is one of four border crossings connecting Ontario to New York. The others are Lewiston, Whirlpool and Peace Bridge.

The FBI is investigating the vehicle explosion at the border crossing between the United States and Canada, the US law enforcement agency said in a statement as per news agency Reuters.

“The FBI is coordinating with our local, state, and federal law enforcement partners in this investigation. As this situation is very fluid, that’s all we can say at this time,"" it said.

The CEO of the Buffalo & Fort Erie Public bridge authority said,

“Currently all four international bridges over the Niagara River are closed as the incident is being investigated,” said CEO Ron Rienas.

Doug Ford, the premier of Ontario, which borders New York, said, “Our provincial law enforcement is actively engaged in assessing the situation.

He informed, ""They are working with local law enforcement and are providing support as required.”

Photos and videos widely shared online showed a security booth which was burnt after the explosion.

A 27-year-old man was taken to Niagara Falls Memorial Hospital with minor injuries, including back pain and minor cuts but his condition is not severe, Fox News reported.

In response to the vehicle explosion, the Niagara Falls International Airport is increasing security at the airport and rail system, reports suggested.

Get Latest World News along with Latest News from India at Hindustan Times.

SHARE THIS ARTICLE ON

ABOUT THE AUTHOR Mallika Soni When not reading, this ex-literature student can be found searching for an answer to the question, ""What is the purpose of journalism in society?"" ...view detail

Click to Top

Story Saved",World
France calls for EU sanctions against Hamas officials,"We're now on WhatsApp. Click to join.

The idea would be to ""specifically target certain individuals"" with ""mainly financial"" sanctions such as an asset freeze, she added without specifying who should be targeted.

READ | US issues second round of sanctions on Hamas, members of Iran's Revolutionary Guard

France also wants EU sanctions slapped on people linked to Hamas and its ally, Lebanon's pro-Iran Hezbollah, like the sanctions the bloc has imposed on some Iranians over their role in the war in Ukraine.

The EU in February imposed sanctions on seven Iranian firms which make drones used by Russia to strike targets in Ukraine.

France's proposal could be adopted by EU foreign ministers in December, Boone said. It has the backing of Germany and Italy, according to her entourage.

The United States in October imposed sanctions against 10 ""key"" members of Hamas based in Gaza, Sudan, Turkey, Algeria and Qatar who are involved in financing the group's activities.

Israel has bombarded the Gaza Strip following the October 7 attack by Hamas that Israel says killed 1,200 people. The group took 239 hostages.

Gaza's Hamas-run government says more than 14,100 people have been killed in Israel's aerial and ground offensive since -- two thirds of them women and children.

Get Latest World News along with Latest News from India at Hindustan Times.

SHARE THIS ARTICLE ON

Click to Top

Story Saved",World
"'Neutral' Switzerland takes side: Defends Israel, looks to ban Hamas","We're now on WhatsApp. Click to join.

ALSO READ| Wadi Al-Salam cemetery is the world's largest graveyard. What we know

On Wednesday, Switzerland also ended its cooperation with three Palestinian non-governmental organizations, without naming them, saying there were breaches of conduct and anti-discrimination policies. The investigation, ordered after Hamas’s deadly attack against Israel on Oct. 7, found no instances of suspect financing though.

Get Latest World News along with Latest News from India at Hindustan Times.

SHARE THIS ARTICLE ON

Click to Top

Story Saved",World
Biden declares emergency in US Virgin Islands amid water contamination crisis,"We're now on WhatsApp. Click to join.

Officials told residents to stop using their taps and began distributing vouchers for bottled water. Lead can have devastating effects on childhood development, behavior and IQ scores.

But experts consulted by The Associated Press said the frightening results may be false because they came from testing that does not meet EPA standards.

“The data should be thrown into the garbage,” said Marc Edwards, a Virginia Tech lead and water expert who helped identify the lead problems in Flint, Michigan.

If the information given to St. Croix residents turns out to be bad, it won't be the first time that's happened. Poor information often plagues communities, and they are often majority-Black communities, facing lead crises, leaving people unsure what to believe. In Flint, officials initially concealed high lead levels. When levels spiked in Newark, officials emphasized the safety of the city’s reservoirs even though it is lead pipes – not the source – that are usually the problem. In Benton Harbor, Michigan, residents waited months for officials to confirm that filters truly work, relying on bottled water.

On the Caribbean island of St. Croix, officials avoided some of those pitfalls and quickly told residents of the results. The governor declared an emergency.

“This is not something that we shy away from talking about,” said Andrew Smith, head of the Virgin Islands Water and Power Authority.

Edwards does not believe the sky-high results reflect reality and said the problem is how the samples were collected. For lead testing, workers usually take water from a household faucet. But the samples that tested so high on St. Croix were collected from the meter.

“When you (unscrew) it, you are literally ripping the leaded-brass apart and a chunk of leaded-brass gets in your sample,” he said. It produces artificially high results.

Tom Neltner, a chemical and lead expert at the Environmental Defense Fund, agreed that testing from the water meter isn't accurate. “There's a lot of oddities” about how St. Croix's sampling was done, he said.

Parents in St. Croix therefore still have no idea how much lead their kids were consuming.

Here’s what is known:

In September, officials tested in the normal way, at faucets, following EPA lead testing rules. Those results showed the water was safe.

But island residents, who had long dealt with discolored water, said the color was getting even worse in recent months. So officials took more samples, this time at the meter, to see whether the utility's pipes were the problem. It is some of these tests that first recorded astronomically high lead levels.

“We were all shocked and surprised by the results,” Smith said.

Retesting found results were still too high. Other locations including two schools, however, were low.

A more definitive answer should come soon. Local and federal officials did detailed testing to find the root cause in early November. A final report is expected in mid-December.

Smith said about 3,400 homes are affected and that the utility worked with EPA on the sampling.

Even though the tests didn't follow the normal procedure, EPA water expert Christine Ash said “out of an abundance of caution, we are recommending that folks who use (utility) water piped to their homes not consume the water until we're able to do further investigation to identify if there is a potential source of lead and what it might be.”

Fortunately on St. Croix, that doesn't include everyone.

A lot of people rely on rainwater they collect in cisterns.

On the mainland, in many cities, lead pipes are the main threat to drinking water. That's not the problem on the island, however. Instead, it's brass fittings that contain lead and can corrode into the water, Smith said.

And regardless of the test results, the water system needs attention and fixing. Smith and his colleagues are flushing water through it. When people don't use the water, it sits and can pick up contaminants. They are also fixing how they treat their water so it is less corrosive and working to replace components that contain lead. That replacement work might take 12 to 18 months, Smith said. Plus, the island’s water system is old and in the coming years, major upgrades are planned.

Gerard said people on the island are overwhelmed.

“There’s this sense of well, what’s next for St. Croix?” she said, adding that residents have endured a devastating hurricane, the pandemic and water contamination from a refinery, all in recent years. Many people gave up on tap water long ago, she said, and it's hard to know what to make of these latest developments.

“As a fairly literate person, reading the reports has almost left us with more questions than answers.” Many people probably don’t understand just how high these lead test results are, she said.

As for the temporary measure of flushing lots of water through the pipes to reduce lead, it's ill-suited to the island, she said.

“We're a water conserving society,” Gerard said. “Water is a precious commodity.”

SHARE THIS ARTICLE ON

Click to Top

Story Saved",World
Pakistan applies for BRICS membership; seeks Russia's support,"We're now on WhatsApp. Click to join.

Jamali said Pakistan has already applied for membership in the BRICS-Brazil, Russia, India, China, and South Africa which sis set to expand next year with the admission of six new members under the Russian Presidency.

Pakistan’s application to join the BRICS came as the grouping of emerging economies was set for its biggest expansion with six new members under Russia’s rotating Presidency in 2024.

READ | Pakistan says Brics member blocked participation in Beijing meeting

This year’s BRICS summit held in South Africa formally admitted Argentina, Egypt, Ethiopia, Iran, Saudi Arabia and the United Arab Emirates (UAE) as new members. They will formally join during the 2024 summit in Russia.

Jamali said Islamabad plans to join the group under Russia’s presidency next year.

""Pakistan would like to be part of this important organisation and we are in the process of contacting member countries for extending support to Pakistan’s membership in general and the Russian Federation in particular,"" he said.

The TASS report said that Russian Deputy Foreign Minister Sergey Ryabkov said in early October that BRICS plans to agree on a list of candidates for partner-state status ahead of the upcoming summit in Kazan in 2024.

READ | Brics calls for immediate truce in Gaza

While Pakistan, currently facing its worst economic and political crisis perhaps can count on the support of its all-weather ally China, it is to be seen how the other four members, Brazil, Russia India and South Africa would react to the proposal to admit Islamabad.

The five-member bloc first started as BRIC, (Brazil, Russia, India, China) which was formed after a meeting of its leaders on the margins of the G8 Outreach Summit in 2006 in Russia and held its first summit in 2009.

It later became BRICS with the admission of South Africa and emerged as an influential organisation with the establishment of a bank of its own, called the New Development Bank (NDB) based in Shanghai.

Get Latest World News along with Latest News from India at Hindustan Times.

SHARE THIS ARTICLE ON

Click to Top

Story Saved",World
"Pope Francis meets Israelis, Palestinians. His warning to world on Mideast is…","We're now on WhatsApp. Click to join.

""Wars do this, but here we have gone beyond wars. This is not war, this is terrorism,"" he added, without specifying whether he was referring to the October 7 attack on Israel by Palestinian militant group Hamas or Israel's military operation in Gaza launched in response, or both.

The Vatican said last week the pope hoped to show his ""spiritual closeness"" during the private meetings, which it said would be ""exclusively humanitarian in nature"".

Each delegation told press conferences in Rome following the meetings that they believed Francis could use his moral influence to help them.

Hamas gunmen carried out on October 7 a cross-border attack, the worst in Israel's history, that left around 1,200 people dead, most of them civilians, according to the Israeli government.

Hamas and other Palestinian militant groups also took an estimated 240 Israelis and foreigners hostage, among them elderly people and young children.

In retaliation, Israel launched a major bombing campaign and ground offensive in Gaza, which the Hamas government said has killed 14,100 people, mostly civilians and thousands of them children.

""Let us pray that the difficulties resolve themselves in dialogue and negotiation and not with a mountain of dead on each side,"" Francis said in a video message released Wednesday.

ALSO READ| Vladimir Putin's olive branch? Russian leader says this on Ukraine ‘tragedy'

Rachel Goldberg, whose 23-year-old son Hersh Goldberg-Polin was kidnapped by Hamas, told journalists the pope ""has a lot of influence"".

""He's very respected in the Muslim world, in the Jewish world, really irrespective of religious background. So I think that when he speaks the world really listens.""

Palestinian Yousef Lalkhoury said the pope was capable of asking for a ""just peace"" for his people.

""We have urged him to visit Gaza because we believe he can stop the war,"" Lalkhoury said.

Short of freeing all the hostages, the Israeli delegation said it hoped Francis could push for the Red Cross to be allowed access to them.

- 'Broken heart' -

Israel and Hamas announced a deal on Wednesday allowing at least 50 hostages and scores of Palestinian prisoners to be freed, while offering besieged Gaza residents a four-day truce after weeks of all-out war.

""I'm not counting hostages being freed in this deal until I see them walk over the border and see them embraced safely,"" said Goldberg, who was among 12 families of hostages represented in the meeting with the pope.

Muhamed Halalo, an IT manager from Gaza who lives in Belgium, was one of 10 Muslim and Christian Palestinians who met with Francis.

""I have a broken heart, my eyes full of tears,"" he said as he described how his entire extended family had been wiped out in a strike that killed 30 people.

Israeli Adav Kipnis said his parents were murdered during the October 7 attack and seven of his family members were kidnapped.

""We don't know if those captured are alive, if they are injured... Give us information if they are even alive and being taken care of,"" he said.

The Palestinians present claimed the pope used the word ""genocide"" during their meeting to describe what was happening in Gaza.

""I am not aware of him using that word,"" Vatican spokesman Matteo Bruni told AFP, adding that he had been present at the meeting.

The pope ""used the terms he used to express himself during the weekly audience and words that in any case represent the terrible situation in Gaza"", Bruni said.

The pope has never described it as genocide in public.

""He spoke to us about what he already knew about Gaza, and he's the one who described what's happened as a genocide"", Shireen Hilal from Bethlehem insisted.

""He said that terror cannot or should not justify terror"".

Get Latest World News along with Latest News from India at Hindustan Times.

SHARE THIS ARTICLE ON

Click to Top

Story Saved",World
UNICEF says Gaza world's 'most dangerous place' for children: ‘To survive…’,"We're now on WhatsApp. Click to join.

""This is unprecedented,"" said Russell, who had just returned from a trip to southern Gaza. ""I am haunted by what I saw and heard.""

Russell welcomed a deal reached Wednesday by Israel and Hamas to free hostages and pause ferocious fighting and bombardment in Gaza.

Some 240 people -- ranging from infants to the elderly -- were taken captive during the October 7 attack by Hamas militants that killed about 1,200 in Israel, mostly civilians, according to Israeli authorities.

But Russell said that a pause is not enough and called for ""an urgent humanitarian ceasefire to immediately put a stop to this carnage.""

""For children to survive..., for humanitarian workers to stay and effectively deliver..., humanitarian pauses are simply not enough,"" she said.

Russell said that an additional 1,200 children are believed to remain under the rubble of bombed-out buildings or are otherwise unaccounted for.

""In addition to bombs, rockets, and gunfire, Gaza's children are at extreme risk from catastrophic living conditions,"" Russell added.

""One million children -- or all children inside the territory -- are now food insecure, facing what could soon become a catastrophic nutrition crisis.""

UNICEF estimates that acute malnutrition in children could increase by nearly 30 per cent in Gaza over the next months.

Also addressing the Security Council, the head of the United Nations Population Fund, Natalia Kanem, drew attention to the plight of Gaza's pregnant women, with some 5,500 expected to deliver babies under appalling conditions in the coming month.

""At a moment when new life is beginning, what should be a moment of joy is overshadowed by death and destruction, horror and fear,"" said Kanem.

Get Latest World News along with Latest News from India at Hindustan Times.

SHARE THIS ARTICLE ON

Click to Top

Story Saved",World
Ukraine troops face 'difficult defence' in east: What Zelensky said,"We're now on WhatsApp. Click to join.

""Difficult weather, difficult defence on the Lyman, Bakhmut, Donetsk and Avdiivka fronts. Offensive actions in the south,"" Zelenskiy said on Telegram messenger.

Snow and freezing temperatures that stood at about minus 5 degrees Celsius during the day on Wednesday and were expected to drop lower may further complicate operations on the battleground, where fighting is moving to an attritional phase.

Russia, which launched a full-scale invasion in February 2022, controls nearly a fifth of Ukraine. Kyiv launched a counteroffensive to retake occupied territory this summer, but has not forced a major breakthrough.

Since mid-October, Avdiivka, where the front line has changed little since the first war erupted in 2014 between Kyiv and Russian-backed militants, faced waves of attacks followed by temporary lulls, according to the Ukrainian military.

After one such lull the day before, the head of the ""Tavria"" military command said on Wednesday that Russian troops had ""dramatically increased"" the number of assaults and airstrikes.

""Our defenders are steadfastly holding the defence in the Avdiivka direction,"" Commander Oleksandr Tarnavskyi said on Telegram. Ukrainian forces continued the offensive on the southeastern Melitopol front, he added.

In their morning readout on the battlefield, the General Staff said troops were also holding onto the bridgeheads secured on the eastern side of the River Dnipro that was occupied by Russian forces in the early days of their invasion.

Reuters could not independently verify the frontline reports.

Get Latest World News along with Latest News from India at Hindustan Times.

SHARE THIS ARTICLE ON

Click to Top

Story Saved",World
California's Marin County enforces extended mask mandate to curb COVID-19,"We're now on WhatsApp. Click to join.

Amidst global debates on the efficacy of face masks, a comprehensive review by the Royal Society in the UK in August unequivocally supported their role in reducing COVID-19 infections. However, this preventive measure has faced opposition from several prominent Republicans. Texas Governor Greg Abbott, for instance, signed a law prohibiting government agencies from enforcing mask mandates in the state.

In contrast, Marin County's decision aligns with its commitment to public health. The mandate carries potential penalties, including misdemeanours or jail time, for non-compliance. County officials clarified that the order aims to safeguard individuals in high-risk healthcare settings and curb the spread of respiratory viruses like RSV, influenza, and COVID-19.

""The intent of the order is to protect individuals in these high-risk healthcare settings and limit the spread of seasonal respiratory viruses,"" stated Marin County officials. The mandate applies to all individuals in patient care areas, with exemptions for children under age 6 and those with valid medical reasons.

While Marin County reinforces its commitment to public health, other regions in California, such as Huntington Beach, have taken a different stance, banning masks in the future after a lengthy city council meeting.

While temporary mask requirements have been implemented in various U.S. locations this year, a federal mask mandate remains improbable. Officials emphasize that the choice to wear masks will continue to be a personal decision, alongside other preventive measures like vaccinations, at-home testing, and treatments.

Jeff Nesbit, assistant secretary for public affairs for health and human services, reiterated in September, ""To be clear, the rumours of a federal mask mandate are not true."" The focus remains on providing a range of tools for individuals to protect themselves from the impact of COVID-19.

SHARE THIS ARTICLE ON

Click to Top

Story Saved",World
California's Marin County enforces extended mask mandate to curb COVID-19,"We're now on WhatsApp. Click to join.

Amidst global debates on the efficacy of face masks, a comprehensive review by the Royal Society in the UK in August unequivocally supported their role in reducing COVID-19 infections. However, this preventive measure has faced opposition from several prominent Republicans. Texas Governor Greg Abbott, for instance, signed a law prohibiting government agencies from enforcing mask mandates in the state.

In contrast, Marin County's decision aligns with its commitment to public health. The mandate carries potential penalties, including misdemeanours or jail time, for non-compliance. County officials clarified that the order aims to safeguard individuals in high-risk healthcare settings and curb the spread of respiratory viruses like RSV, influenza, and COVID-19.

""The intent of the order is to protect individuals in these high-risk healthcare settings and limit the spread of seasonal respiratory viruses,"" stated Marin County officials. The mandate applies to all individuals in patient care areas, with exemptions for children under age 6 and those with valid medical reasons.

While Marin County reinforces its commitment to public health, other regions in California, such as Huntington Beach, have taken a different stance, banning masks in the future after a lengthy city council meeting.

While temporary mask requirements have been implemented in various U.S. locations this year, a federal mask mandate remains improbable. Officials emphasize that the choice to wear masks will continue to be a personal decision, alongside other preventive measures like vaccinations, at-home testing, and treatments.

Jeff Nesbit, assistant secretary for public affairs for health and human services, reiterated in September, ""To be clear, the rumours of a federal mask mandate are not true."" The focus remains on providing a range of tools for individuals to protect themselves from the impact of COVID-19.

SHARE THIS ARTICLE ON

Click to Top

Story Saved",World
California's Marin County enforces extended mask mandate to curb COVID-19,"We're now on WhatsApp. Click to join.

Amidst global debates on the efficacy of face masks, a comprehensive review by the Royal Society in the UK in August unequivocally supported their role in reducing COVID-19 infections. However, this preventive measure has faced opposition from several prominent Republicans. Texas Governor Greg Abbott, for instance, signed a law prohibiting government agencies from enforcing mask mandates in the state.

In contrast, Marin County's decision aligns with its commitment to public health. The mandate carries potential penalties, including misdemeanours or jail time, for non-compliance. County officials clarified that the order aims to safeguard individuals in high-risk healthcare settings and curb the spread of respiratory viruses like RSV, influenza, and COVID-19.

""The intent of the order is to protect individuals in these high-risk healthcare settings and limit the spread of seasonal respiratory viruses,"" stated Marin County officials. The mandate applies to all individuals in patient care areas, with exemptions for children under age 6 and those with valid medical reasons.

While Marin County reinforces its commitment to public health, other regions in California, such as Huntington Beach, have taken a different stance, banning masks in the future after a lengthy city council meeting.

While temporary mask requirements have been implemented in various U.S. locations this year, a federal mask mandate remains improbable. Officials emphasize that the choice to wear masks will continue to be a personal decision, alongside other preventive measures like vaccinations, at-home testing, and treatments.

Jeff Nesbit, assistant secretary for public affairs for health and human services, reiterated in September, ""To be clear, the rumours of a federal mask mandate are not true."" The focus remains on providing a range of tools for individuals to protect themselves from the impact of COVID-19.

SHARE THIS ARTICLE ON

Click to Top

Story Saved",World
